{
  "schemaVersion": 1,
  "id": "vendor-local-service",
  "name": "厂商·本地 MCP 示例",
  "vendor": "厂商名称",
  "icon": "🔐",
  "category": "开发工具",
  "summary": "演示市场凭据如何安全注入 stdio 环境变量",
  "description": "目录只声明输入字段和环境变量映射；用户填写的真实值仅保存在 DSH 本机。",
  "published": false,
  "featured": false,
  "homepage": "https://example.com/mcp",
  "probeStatus": "unverified",
  "auth": {
    "mode": "api-key",
    "credentialFields": [
      {
        "key": "apiToken",
        "label": "服务 API Token",
        "placeholder": "仅保存在 DSH 本机",
        "description": "从服务控制台创建，不得提交到目录。",
        "required": true,
        "secret": true
      },
      {
        "key": "region",
        "label": "区域",
        "placeholder": "例如 cn-east-1",
        "required": true,
        "secret": false
      }
    ]
  },
  "servers": [
    {
      "serverKey": "main",
      "serverName": "vendor-local-service",
      "transport": "stdio",
      "command": "npx",
      "args": ["-y", "@vendor/example-mcp-server"],
      "env": {
        "LOG_LEVEL": "info"
      },
      "credentialBindings": {
        "VENDOR_API_TOKEN": "apiToken",
        "VENDOR_REGION": "region"
      }
    }
  ]
}
